[
  {
    "id": "log-21",
    "boat_id": "mat-leric",
    "thread_label": "Mat Leric",
    "date": "2026-09-03",
    "sender": "Chris Lafrance",
    "subject": "RE: FW: Mat Leric – FP Salina 48 refit details and offshore questions",
    "availability": "Available; increased demand",
    "facts": "French-side broker has questions and is gathering documents; no technical answers yet.",
    "triage": "No ranking change.",
    "next_action": "Wait for refit/mast/survey records and price range.",
    "priority": "P3",
    "gmail_message_id": "1a067346d11b6efc",
    "gmail_url": "https://mail.google.com/mail/u/0/#all/1a067346d11b6efc"
  },
  {
    "id": "log-22",
    "boat_id": null,
    "thread_label": "Dream/Navigare 450 + Helia package",
    "date": "2026-09-03",
    "sender": "Gerry Jacob",
    "subject": "RE: Two Lagoon 450Fs I also noticed",
    "availability": "Multiple available",
    "facts": "All Dream/Navigare Lagoon 450s reportedly had bulkhead repair and all boats chartered since new. Gingembre: replacement engines due failure, original rig, acid bank, no genset/A-C. Divalto: original rig, acid bank, no genset/A-C. Cristal: original rig, ~8,000h genset.",
    "triage": "Material downgrade across Gingembre/Divalto/Cristal; headline fleet-exit pricing hides significant rig/off-grid/genset capex.",
    "next_action": "Follow-up sent asking for omitted hard facts on Moet and Loumilis II; no offer/travel discussion.",
    "priority": "P2",
    "gmail_message_id": "1a0664a6e4b4c6a1",
    "gmail_url": "https://mail.google.com/mail/u/0/#all/1a0664a6e4b4c6a1"
  },
  {
    "id": "log-23",
    "boat_id": null,
    "thread_label": "NetBoat future inventory",
    "date": "2026-09-03",
    "sender": "Carla Bianchini",
    "subject": "RE: Catamaran criteria / keep me in mind",
    "availability": "Two Lagoon 42s coming soon",
    "facts": "Carla says she expects to have two Lagoon 42s for sale very soon and will send details.",
    "triage": "Potential off-market/early inventory source; no action required yet.",
    "next_action": "Wait for specs/prices.",
    "priority": "P3",
    "gmail_message_id": "1a06359021091b50",
    "gmail_url": "https://mail.google.com/mail/u/0/#all/1a06359021091b50"
  },
  {
    "id": "fresh-1",
    "boat_id": "vikama",
    "thread_label": "Vikama",
    "date": "2026-09-03",
    "sender": "Gary Haynes",
    "subject": "Re: VIKAMA – 2018 Lagoon 450F / refit diligence",
    "availability": "",
    "facts": "Broker acknowledged the diligence request and is working on substantive answers.",
    "triage": "No ranking change yet; the next information should resolve rig, structural, battery, A/C and engine-hour uncertainty.",
    "next_action": "Wait for Gary’s substantive answers. Do not discuss travel yet.",
    "priority": "P1",
    "gmail_message_id": "1a0687a9d50971f2",
    "gmail_url": "https://mail.google.com/mail/u/0/#all/1a0687a9d50971f2"
  },
  {
    "id": "fresh-2",
    "boat_id": "squid-attack",
    "thread_label": "Squid Attack",
    "date": "2026-09-03",
    "sender": "Rory Greenan",
    "subject": "RE: Squid Attack – 2021 Lagoon 450F at $399k",
    "availability": "",
    "facts": "TMM supplied the full maintenance record. Factory bulkhead modification was augmented locally; original standing rigging; 2024 Doyle main; saildrives serviced every 250h; genset 8,809h; 4× Full River AGM house bank from Nov 2021; 2.5kW inverter; 37 GPH Rainman; no significant structural casualty/claim history beyond a stolen dinghy claim. Charter is finished and boat is available immediately. Seller recently cut price and broker expects little flexibility below $399k.",
    "triage": "Very compelling age/price/platform with unusually strong maintenance transparency, but original rig, old AGM bank, high genset hours and likely solar/lithium modernization are meaningful capex.",
    "next_action": "Review maintenance records; price rig + lithium/solar upgrade; Max decides whether $399k economics justify survey/offer.",
    "priority": "P1",
    "gmail_message_id": "1a0687507faf0096",
    "gmail_url": "https://mail.google.com/mail/u/0/#all/1a0687507faf0096"
  },
  {
    "id": "fresh-3",
    "boat_id": "macera",
    "thread_label": "MACERA",
    "date": "2026-09-03",
    "sender": "Adrian Nicolle",
    "subject": "Re: 2008 Privilege 495 MACERA in San Blas, Panama",
    "availability": "",
    "facts": "Broker delivered consolidated maintenance/refit history and supporting-document register with clarifications on 2022 rigging/chainplates, 2025 engine/injector/turbo work, generator service, owner-built lithium, prior grounding/underwater history, historic blister repairs, hatch leaks, watermakers, sails/navigation and the port-hull coating issue.",
    "triage": "Documentation quality improved materially. Remaining gating issues are the owner-built lithium/insurance acceptability, coating repair, age/TCO and full survey implications.",
    "next_action": "Digest consolidated history before Max decides whether to pursue an exploratory offer subject to viewing/survey.",
    "priority": "P1",
    "gmail_message_id": "1a068686f5abfc78",
    "gmail_url": "https://mail.google.com/mail/u/0/#all/1a068686f5abfc78"
  },
  {
    "id": "fresh-4",
    "boat_id": "pivot",
    "thread_label": "Pivot",
    "date": "2026-09-03",
    "sender": "Brandon Morse",
    "subject": "Re: Pivot – questions from a liveaboard/offshore buyer",
    "availability": "",
    "facts": "Broker confirms the survey-noted starboard foredeck crack was repaired and repainted, but no invoice exists because work was cash. Crossbeam corrosion was judged surface-level by the rigging company and owners DIY sanded/repainted it; no invoice. Broker offers video walkthrough with Dutch Yacht Services owner Peter Hoff.",
    "triage": "Repairs are reportedly complete, but documentation is weaker than ideal. Survey protection and direct inspection remain essential.",
    "next_action": "Max decides whether to pursue a survey-contingent offer / video inspection.",
    "priority": "P2",
    "gmail_message_id": "1a06834ebeebddad",
    "gmail_url": "https://mail.google.com/mail/u/0/#all/1a06834ebeebddad"
  },
  {
    "id": "fresh-5",
    "boat_id": "loumilis-ii",
    "thread_label": "Loumilis II",
    "date": "2026-09-03",
    "sender": "Gerry Jacob",
    "subject": "RE: Two Lagoon 450Fs I also noticed",
    "availability": "",
    "facts": "~3,000 engine hours, ~3,000 genset hours, acid batteries, original standing rigging and sails, no solar, Mastervolt 12/2000 inverter; available now.",
    "triage": "Headline price is less attractive after accounting for original rig/sails and full off-grid conversion.",
    "next_action": "Keep as a comp unless price flexibility materially offsets rig/sails/electrical capex.",
    "priority": "P2",
    "gmail_message_id": "1a0680203c0733f8",
    "gmail_url": "https://mail.google.com/mail/u/0/#all/1a0680203c0733f8"
  },
  {
    "id": "fresh-6",
    "boat_id": "moet",
    "thread_label": "Moet",
    "date": "2026-09-03",
    "sender": "Gerry Jacob",
    "subject": "RE: Two Lagoon 450Fs I also noticed",
    "availability": "",
    "facts": "~3,500 engine hours, ~5,000 genset hours, acid batteries, original standing rigging and sails, no solar; inverter present; available now.",
    "triage": "Bulkhead repair remains a positive, but original rig/sails and absent solar make the €343.6k ask less anomalous than it first appeared.",
    "next_action": "Keep active only if phase-out condition and seller flexibility beat newer/turnkey alternatives.",
    "priority": "P2",
    "gmail_message_id": "1a0680203c0733f8",
    "gmail_url": "https://mail.google.com/mail/u/0/#all/1a0680203c0733f8"
  }
]
