[
  {
    "id": "fresh-22",
    "boat_id": "palermo-lagoon-450f",
    "thread_label": "Palermo Lagoon 450F",
    "date": "2026-09-04",
    "sender": "Roberto Goracci / Yacht Studio",
    "subject": "Re: 2020 Lagoon 450F in Palermo – serious interest",
    "availability": "Another client has an option through Sept. 10; another inspection is scheduled Sept. 11",
    "facts": "Roberto says there is no further technical or maintenance information available beyond the earlier reply. Another client currently holds an option until September 10, and a separate prospective buyer is booked to inspect the yacht September 11. He also says the asking price is not very flexible given the current price level.",
    "triage": "Temporarily blocked. The corrected ~2,300 engine hours remain attractive, but document scarcity, 5% buyer commission, limited price flexibility and two buyers ahead of us make further diligence spend or travel inappropriate right now.",
    "next_action": "A short backup-interest reply is saved as a Gmail draft asking Roberto to notify Max if the option lapses or the Sept. 11 inspection does not proceed. Otherwise wait; do not travel, bid or spend on diligence while another buyer controls the boat.",
    "priority": "P1",
    "gmail_message_id": "1a06d71d3a4c380c",
    "gmail_url": "https://mail.google.com/mail/u/0/#all/1a06d71d3a4c380c"
  },
  {
    "id": "fresh-23",
    "boat_id": "anavah-dolphin-460",
    "thread_label": "ANAVAH",
    "date": "2026-09-04",
    "sender": "Andrew Hodgdon / The Multihull Company",
    "subject": "Re: ANAVAH – Dolphin 460 / serious liveaboard-bluewater interest",
    "availability": "Available for showing in St Augustine; broker wants an in-person showing before releasing detailed repair invoices",
    "facts": "Andrew says the owners are willing to provide detailed invoices, but their normal process is to release those items after an interested buyer has seen the boat and as the buyer prepares for an offer. He reiterates that professionals addressed the major Dec. 2024 survey deficiencies, believes a new survey would reflect the upgrades, says there is some price flexibility and strongly encourages Max to get aboard. He also asks where Max is located.",
    "triage": "This is now a buyer-decision gate, not an unanswered-records task. The broker is intentionally withholding the repair bridge until a showing/pre-offer stage, which is material because the prior survey and lightning history make those invoices unusually important.",
    "next_action": "YOUR DECISION: either authorize an in-person St Augustine showing despite the documentation gate, or place ANAVAH on hold. No automatic reply was drafted because answering the broker necessarily involves Max's location/travel intent and could advance the transaction stage.",
    "priority": "P1",
    "gmail_message_id": "1a06d7f1d21f26ed",
    "gmail_url": "https://mail.google.com/mail/u/0/#all/1a06d7f1d21f26ed"
  },
  {
    "id": "fresh-24",
    "boat_id": "mat-leric-salina-48",
    "thread_label": "MAC LERIC",
    "date": "2026-09-04",
    "sender": "Chris Lafrance / David Walters Yachts",
    "subject": "RE: 2009 Fountaine Pajot Salina 48 MAC LERIC – technical information and supporting documentation",
    "availability": "Available; vessel-specific engine-history questions have been forwarded to the seller-side broker",
    "facts": "Chris agrees that the 4,700-hour engine history is the right issue to investigate. He offers his general opinion that this older Volvo generation is reliable, straightforward to maintain and can run very high hours when cared for, then says he will run Max's specific mechanical questions to the other broker.",
    "triage": "No new vessel-specific evidence has arrived yet, so the mechanical reserve and ranking should not change based on a broker's general view of Volvo longevity. The existing documentation package remains unusually strong; the next useful information is the actual service/overhaul evidence.",
    "next_action": "Wait for Chris/the French-side broker to return vessel-specific evidence of 4,000-hour service, top-end/injector/heat-exchanger work, compression testing, oil analysis or overhaul/rebuild. No reply, call, offer or travel is needed now.",
    "priority": "P1",
    "gmail_message_id": "1a06d7ae74394a4b",
    "gmail_url": "https://mail.google.com/mail/u/0/#all/1a06d7ae74394a4b"
  },
  {
    "id": "fresh-25",
    "boat_id": "monaco-blue",
    "thread_label": "Monaco Blue",
    "date": "2026-09-04",
    "sender": "Bill Regan / Catamaran Central",
    "subject": "Re: Monaco Blue – 2012 Lagoon 450F / serious liveaboard-offshore interest",
    "availability": "Available; sellers described as realistic and open to offers but not distressed",
    "facts": "Bill says there is no current seller survey/moisture report and a buyer should commission a pre-purchase survey. He will check for invoices/service records on the major systems; the owners handle routine oil changes, impellers and day-to-day maintenance themselves. The owners bought Monaco Blue from a small Croatian charter company several years ago, cruised the Mediterranean, crossed the Atlantic and have spent the last year-plus in the Caribbean/Bahamas. Bill says the bulkheads were addressed in the Mediterranean and supplied a SharePoint folder with inspection/repair photos. He also says the sellers are realistic, cites a similar BVI boat that sold around $405k and offers to run recent 450F comp sales.",
    "triage": "High-interest candidate. The liveaboard/off-grid package and proven Atlantic use are strong, but the absence of a seller survey and the mix of owner-performed routine maintenance make verification of the expensive professional work especially important. Do not treat the bulkhead issue as closed until the photos/scope are reviewed and a survey confirms current condition.",
    "next_action": "A Gmail reply draft is queued asking only for the big-ticket records—rig/bulkhead work, engine/saildrive history, lithium/Victron installation, generator and recent bottom work—and any recent 450F comp-sales analysis. Review the bulkhead folder while waiting. No travel, call or offer yet.",
    "priority": "P1",
    "gmail_message_id": "1a06df7c93237423",
    "gmail_url": "https://mail.google.com/mail/u/0/#all/1a06df7c93237423"
  },
  {
    "id": "fresh-26",
    "boat_id": "captiva-lagoon-440",
    "thread_label": "Captiva",
    "date": "2026-09-04",
    "sender": "Caroline Laviolette / The Multihull Company",
    "subject": "Re: Captiva – 2008 Lagoon 440 Owner’s Version / diligence questions",
    "availability": "Available; still in the boatyard following recent maintenance",
    "facts": "Caroline says Captiva's older owner is not tech savvy and that obtaining electronic records will be nearly impossible. The boat is still in the yard from recent maintenance. She asks for a phone number so she can reach Max between showings.",
    "triage": "The lack of a digitized record archive should not automatically eliminate a one-owner/never-chartered boat, but it changes the diligence strategy: get a small set of decision-driving facts first, then decide whether a call and independent survey are worth pursuing. Do not invent or disclose a phone number automatically.",
    "next_action": "A Gmail reply draft is queued saying email is easiest for now and requesting only current engine/generator hours, standing-rig age, approximate solar/house-bank setup, material casualty/structural history and remaining post-yard projects. Decide on a call only after those basics arrive.",
    "priority": "P1",
    "gmail_message_id": "1a06dd89dceccb3e",
    "gmail_url": "https://mail.google.com/mail/u/0/#all/1a06dd89dceccb3e"
  }
]
