[
  {
    "id": "log-11",
    "boat_id": "larnaca-lagoon-450f",
    "thread_label": "Larnaca Lagoon 450F",
    "date": "2026-09-02",
    "sender": "Lior Sofer",
    "subject": "RE: 2012 Lagoon 450F in Larnaca – a few detailed questions",
    "availability": "Available; €305k negotiable",
    "facts": "Ex-charter to 2020; ~5,800h engines; saildrives serviced 2024; new 2022 genset <900h; 3-year-old A/C/nav/watermaker/solar/lithium; Lagoon-agent bulkhead kit/certificate 2024; standing rig + main + genoa are original 2012.",
    "triage": "Legitimate value play, but full rig + sails are known near-term capex before ocean crossing.",
    "next_action": "Get 2022 rig report + 2024 bulkhead certificate; price full rig/sails and negotiate accordingly.",
    "priority": "P2",
    "gmail_message_id": "1a060dcb5ce9c4be",
    "gmail_url": "https://mail.google.com/mail/u/0/#all/1a060dcb5ce9c4be"
  },
  {
    "id": "log-12",
    "boat_id": "pivot",
    "thread_label": "Pivot",
    "date": "2026-09-02",
    "sender": "Brandon Morse",
    "subject": "Re: Pivot – questions from a liveaboard/offshore buyer",
    "availability": "Available",
    "facts": "Broker acknowledges questions and says our exact use case matches how Pivot has been used/set up; substantive answers pending.",
    "triage": "Still interesting; do not upgrade until mechanical/structural answers land.",
    "next_action": "Wait for detailed response.",
    "priority": "P3",
    "gmail_message_id": "1a05fb7acd726fa3",
    "gmail_url": "https://mail.google.com/mail/u/0/#all/1a05fb7acd726fa3"
  },
  {
    "id": "log-13",
    "boat_id": "blue-pearl-too",
    "thread_label": "Blue Pearl Too",
    "date": "2026-09-02",
    "sender": "Chris Block",
    "subject": "RE: Blue Pearl Too – serious interest in the 2017 Lagoon 42",
    "availability": "Available; $349k",
    "facts": "Broker wants phone call. Listing confirms 2kW solar, 1,200Ah lithium, 3kW inverter, 2023 main, 2025 saildrive seals, watermaker and washer/dryer; ~3,374h engines.",
    "triage": "Very strong off-grid 42, but price must be justified versus cheaper 2018–20 Lagoon 42 comps.",
    "next_action": "Reply with number/time and test ~$300k survey-contingent offer viability.",
    "priority": "P1",
    "gmail_message_id": "1a06206b40461878",
    "gmail_url": "https://mail.google.com/mail/u/0/#all/1a06206b40461878"
  },
  {
    "id": "log-14",
    "boat_id": "pivot",
    "thread_label": "Pivot",
    "date": "2026-09-02",
    "sender": "Brandon Morse",
    "subject": "Re: Pivot – questions from a liveaboard/offshore buyer",
    "availability": "Available",
    "facts": "Detailed file stack/recent survey offered; 2024 engine baseline service, mounts + saildrive seals/shafts, Gideon kits; $20k symptom-driven bulkhead repair; 2022 lithium; 10,320h genset.",
    "triage": "Mixed but actionable: refit is real, but structural history, generator hours and 51-ft carrying costs prevent a clean upgrade.",
    "next_action": "Receipt confirmed to Brandon; asked whether Dec. 2025 crossbeam/foredeck survey findings were repaired and requested invoices/photos.",
    "priority": "P2",
    "gmail_message_id": "1a0642348e163d41",
    "gmail_url": "https://mail.google.com/mail/u/0/#all/1a0642348e163d41"
  },
  {
    "id": "log-15",
    "boat_id": "island-time",
    "thread_label": "Island Time",
    "date": "2026-09-02",
    "sender": "Amanda Haley / owner Mike",
    "subject": "Fwd: Island Time power setup",
    "availability": "Available",
    "facts": "10×100Ah Dragonfly lithium, copper bus bars, 1,920W SunPower solar, Victron 3kW/120A; owner reports weeks off-grid and models six-hour A/C night mode at ~300Ah.",
    "triage": "Strengthened: the electrical/A-C setup is credible and unusually well explained; invoices and survey still gate travel.",
    "next_action": "Max decides whether to schedule owner call; obtain invoices/survey first. No response sent.",
    "priority": "P1",
    "gmail_message_id": "1a0635b5ed6af5d6",
    "gmail_url": "https://mail.google.com/mail/u/0/#all/1a0635b5ed6af5d6"
  },
  {
    "id": "log-16",
    "boat_id": "before-sunrise",
    "thread_label": "Before Sunrise",
    "date": "2026-09-02",
    "sender": "Chris Rundlett",
    "subject": "Re: Before Sunrise – serious interest in the 2015 FP Lipari 41",
    "availability": "Available; seller open high-$200s/low-$300s",
    "facts": "Recall-replacement 2023 engines; original 2015 sails/likely original saildrives; 1,168h genset in Mar.; maintenance log documents 2023 blister repair/barrier coat, $11k solar and 2023–25 service.",
    "triage": "Strong value improvement, but blister repair, original sails/saildrives and tax/duty status remain survey/diligence gates.",
    "next_action": "Wait for owner confirmations; Max decides on offered live video tour. No response sent.",
    "priority": "P1",
    "gmail_message_id": "1a063de18d1a6d1f",
    "gmail_url": "https://mail.google.com/mail/u/0/#all/1a063de18d1a6d1f"
  },
  {
    "id": "log-17",
    "boat_id": "adeline",
    "thread_label": "Adeline",
    "date": "2026-09-02",
    "sender": "Chuck d'Hemecourt",
    "subject": "Re: Adeline – 2014 Lagoon 450F",
    "availability": "Available / technical reply pending",
    "facts": "Broker acknowledged while driving and offered phone/text; no technical answers supplied.",
    "triage": "No ranking change until substantive records arrive.",
    "next_action": "Wait, or Max may choose to call for faster answers. No response sent.",
    "priority": "P3",
    "gmail_message_id": "1a063d5a43f2e498",
    "gmail_url": "https://mail.google.com/mail/u/0/#all/1a063d5a43f2e498"
  },
  {
    "id": "log-18",
    "boat_id": "after-glow",
    "thread_label": "After Glow",
    "date": "2026-09-03",
    "sender": "Chesnee Cogswell",
    "subject": "Re: After Glow – Voyage 480, serious liveaboard/offshore interest",
    "availability": "Available; broker thinks ~$350k can work",
    "facts": "Attachments opened: West End invoice documents invasive port-hull core/skin repair and PORT rudder recore/ovalized stock exit; current house bank is 2×255Ah AGM. This conflicts with earlier 'starboard rudder' description.",
    "triage": "Downgraded. Lower likely price helps, but structural discrepancy + original rig + 15,404h genset + off-grid conversion remain too much at anything near ask.",
    "next_action": "Max decision only: pursue a deeply survey-protected sub-$350k offer or pass. No call/offer initiated.",
    "priority": "P3",
    "gmail_message_id": "1a067d37bf11ebe2",
    "gmail_url": "https://mail.google.com/mail/u/0/#all/1a067d37bf11ebe2"
  },
  {
    "id": "log-19",
    "boat_id": "macera",
    "thread_label": "MACERA",
    "date": "2026-09-03",
    "sender": "Adrian Nicolle",
    "subject": "2008 Privilege 495 MACERA in San Blas, Panama",
    "availability": "Available",
    "facts": "14-page attachment opened. Broker holds Todomar engine, French Marine SD60 and US Spars rig documentation; actual displays ~4,082/3,341h, genset 2,836h. Original Hydranet sails; owner-built lithium maker/BMS unknown; coating repair pending.",
    "triage": "Strengthened documentation case, but battery safety/insurance, coating, original sails and 49-ft TCO remain real gates.",
    "next_action": "Wait for owner answers; then Max decides whether an exploratory offer subject to viewing/survey is warranted.",
    "priority": "P1",
    "gmail_message_id": "1a067c6f22d05e97",
    "gmail_url": "https://mail.google.com/mail/u/0/#all/1a067c6f22d05e97"
  },
  {
    "id": "log-20",
    "boat_id": "total-eclipse",
    "thread_label": "Total Eclipse",
    "date": "2026-09-03",
    "sender": "Dave Wiley",
    "subject": "Re: Total Eclipse – 2018 Lagoon 42 in Curaçao / serious interest",
    "availability": "Available; motivated seller",
    "facts": "Current engine hours confirmed ~2,225; boat sat on hard for years during COVID; owner reports no casualty/structural history. Broker says detailed records would be obtained during contract due diligence.",
    "triage": "Still attractive, but documentation-before-contract is weaker than ideal.",
    "next_action": "Max decides whether to negotiate a fully subject-to contract before travel; no response sent.",
    "priority": "P2",
    "gmail_message_id": "1a067bfef311060a",
    "gmail_url": "https://mail.google.com/mail/u/0/#all/1a067bfef311060a"
  }
]
