[
  {
    "id": "log-1",
    "boat_id": "island-time",
    "thread_label": "Island Time",
    "date": "2026-09-02",
    "sender": "Amanda Haley",
    "subject": "Some answers from the owner - Island Time",
    "availability": "Available",
    "facts": "Owner confirms proactive Just Cats repower (not recall), transferable Yanmar registration, q250h service, 3 full cruising seasons, mast/rig overhaul, no known serious repairs, 2019-ish main, newer Doyle jib, all major systems working.",
    "triage": "Strengthened. Best combination of readiness, documentation path, geography and responsive seller so far.",
    "next_action": "Schedule owner call; get invoices + survey; verify exact electrical/A-C draw.",
    "priority": "P1",
    "gmail_message_id": "1a0633b9a88ce972",
    "gmail_url": "https://mail.google.com/mail/u/0/#all/1a0633b9a88ce972"
  },
  {
    "id": "log-2",
    "boat_id": "bound-for-freedom",
    "thread_label": "Bound for Freedom",
    "date": "2026-09-02",
    "sender": "Caroline Laviolette",
    "subject": "Re: Bound for Freedom – serious interest / refit diligence",
    "availability": "Available",
    "facts": "Broker wants to discuss by phone today; no technical answers yet.",
    "triage": "Still highly interesting; response quality depends on call.",
    "next_action": "Reply with number/time; cover rig, survey, US-buyer restriction, A/C and seller flexibility.",
    "priority": "P1",
    "gmail_message_id": "1a063189f474cde7",
    "gmail_url": "https://mail.google.com/mail/u/0/#all/1a063189f474cde7"
  },
  {
    "id": "log-3",
    "boat_id": null,
    "thread_label": "Dream/Navigare 450 + multihull package",
    "date": "2026-09-02",
    "sender": "Gerry Jacob",
    "subject": "RE: Two Lagoon 450Fs I also noticed",
    "availability": "Multiple available",
    "facts": "Fresh PDFs received for Cristal, Moet, Loumilis II, Kajsa, Divalto, King Lewis, Gingembre, ARACARI and Libertas DS.",
    "triage": "Cristal/Moet/Loumilis are the first three to push; attached-package data improves triage but not enough for purchase diligence.",
    "next_action": "Ask for phase-out/maintenance files, structural certs, current hours/rig/sails, release dates and executable prices.",
    "priority": "P1",
    "gmail_message_id": "1a062f88e7b2dc2f",
    "gmail_url": "https://mail.google.com/mail/u/0/#all/1a062f88e7b2dc2f"
  },
  {
    "id": "log-4",
    "boat_id": null,
    "thread_label": "Dream/Navigare Lagoon 40 fleet",
    "date": "2026-09-02",
    "sender": "Gerry Jacob",
    "subject": "RE: Lagoon 40",
    "availability": "Fleet boats available subject to release",
    "facts": "No seller surveys; purchaser surveys after fleet use ends; no damage known to broker; fleet serviced annually in low season.",
    "triage": "Useful process clarification, but 'no known damage' is not a substitute for phase-out file + independent survey.",
    "next_action": "Get phase-out/maintenance records for the strongest 40/42 candidates before travel.",
    "priority": "P2",
    "gmail_message_id": "1a062f6d127734e9",
    "gmail_url": "https://mail.google.com/mail/u/0/#all/1a062f6d127734e9"
  },
  {
    "id": "log-5",
    "boat_id": "le-marin-lagoon-40",
    "thread_label": "2018 Le Marin Lagoon 40",
    "date": "2026-09-02",
    "sender": "Carla Bianchini",
    "subject": "RE: 2018 Lagoon 40 in Le Marin – serious buyer / a few diligence questions",
    "availability": "SOLD",
    "facts": "Broker confirms the boat is sold and asks for our search criteria for alternatives.",
    "triage": "Archive boat; keep broker relationship.",
    "next_action": "No boat follow-up; source similar inventory through NetBoat.",
    "priority": "P3",
    "gmail_message_id": "1a06287e1d595894",
    "gmail_url": "https://mail.google.com/mail/u/0/#all/1a06287e1d595894"
  },
  {
    "id": "log-6",
    "boat_id": "mat-leric",
    "thread_label": "Mat Leric",
    "date": "2026-09-02",
    "sender": "Chris Lafrance",
    "subject": "RE: FW: Mat Leric – FP Salina 48 refit details and offshore questions",
    "availability": "Available / pending confirmation",
    "facts": "Chris says he is about to call the French side.",
    "triage": "No new diligence yet.",
    "next_action": "Wait for substantive seller/refit records, especially reason for 2025 mast replacement.",
    "priority": "P3",
    "gmail_message_id": "1a062f794f7ab1c6",
    "gmail_url": "https://mail.google.com/mail/u/0/#all/1a062f794f7ab1c6"
  },
  {
    "id": "log-7",
    "boat_id": "wanderer",
    "thread_label": "WANDERER",
    "date": "2026-09-02",
    "sender": "Chesnee Cogswell",
    "subject": "Re: WANDERER – serious interest in the 2020 Lagoon 42",
    "availability": "UNDER CONTRACT",
    "facts": "Acceptance signed; broker reports heavy interest and expects closing.",
    "triage": "Remove from active ranking; excellent market comp.",
    "next_action": "Backup only; do not chase unless deal fails.",
    "priority": "P4",
    "gmail_message_id": "1a06270341b0c846",
    "gmail_url": "https://mail.google.com/mail/u/0/#all/1a06270341b0c846"
  },
  {
    "id": "log-8",
    "boat_id": "after-glow",
    "thread_label": "After Glow",
    "date": "2026-09-02",
    "sender": "Chesnee Cogswell",
    "subject": "Re: After Glow – Voyage 480, serious liveaboard/offshore interest",
    "availability": "Available",
    "facts": "Detailed maintenance file confirms original rig/main, 15,404h genset, no solar/radar/AIS/backup autopilot and documented rudder/delamination repairs; storage paid through Nov 2026.",
    "triage": "Material downgrade at $375k; capex overwhelms turnkey thesis.",
    "next_action": "Only advance at substantial discount after repair/genset/rig documentation.",
    "priority": "P4",
    "gmail_message_id": "1a06269df41c7783",
    "gmail_url": "https://mail.google.com/mail/u/0/#all/1a06269df41c7783"
  },
  {
    "id": "log-9",
    "boat_id": "larimar",
    "thread_label": "Larimar",
    "date": "2026-09-02",
    "sender": "Gary Haynes",
    "subject": "Re: Larimar – serious interest in the 2016 Lagoon 400 S2",
    "availability": "UNDER OFFER",
    "facts": "Survey next week and sea trial the following week; broker expects buyer decision week commencing Sept. 21.",
    "triage": "Archive from active ranking but retain as backup.",
    "next_action": "Wait for Gary's update; move fast only if buyer walks.",
    "priority": "P4",
    "gmail_message_id": "1a061e370d76bf18",
    "gmail_url": "https://mail.google.com/mail/u/0/#all/1a061e370d76bf18"
  },
  {
    "id": "log-10",
    "boat_id": "private-seller-lagoon-450",
    "thread_label": "Private 2017 Lagoon 450",
    "date": "2026-09-02",
    "sender": "Private seller via Boat Trader",
    "subject": "You have an unread message - 2017 Lagoon 450",
    "availability": "Available / seller responsive",
    "facts": "Seller says they sent the requested material, but the survey/oil-analysis documents still have not arrived in Gmail; reply to Boat Trader notification previously bounced.",
    "triage": "Still top-tier on spec, but promised survey remains the gating evidence.",
    "next_action": "Use Boat Trader Messages and request direct resend/share link.",
    "priority": "P1",
    "gmail_message_id": "1a061ae57bb7c886",
    "gmail_url": "https://mail.google.com/mail/u/0/#all/1a061ae57bb7c886"
  }
]
